{
  "id": "awakening-woods",
  "label": "Clairière des Éveils",
  "tileSize": 32,
  "map": [
    "########################",
    "#..........##..........#",
    "#...##...........##....#",
    "#...##...........##....#",
    "#......................#",
    "#......................#",
    "#..........###.........#",
    "#..........###.........#",
    "#...~~~...........##...#",
    "#..~~~~~..........##...#",
    "#...~~~................#",
    "#..............#.......#",
    "#......................#",
    "########################"
  ],
  "spawn": {
    "x": 3,
    "y": 5
  },
  "collectibles": [
    {
      "x": 7,
      "y": 5,
      "itemId": "light-shard"
    },
    {
      "x": 19,
      "y": 4,
      "itemId": "light-shard"
    },
    {
      "x": 16,
      "y": 11,
      "itemId": "light-shard"
    }
  ],
  "actors": [
    {
      "facing": "down-right",
      "x": 2,
      "animation": "Idle",
      "speciesId": "bulbasaur",
      "id": "bulbasaur-visitor",
      "y": 3,
      "roaming": {
        "radius": 1.4,
        "idleMinSeconds": 2.0,
        "idleMaxSeconds": 4.0,
        "behaviorMultiplier": 0.16
      }
    },
    {
      "facing": "down-left",
      "x": 7,
      "animation": "Idle",
      "speciesId": "charmander",
      "id": "charmander-visitor",
      "y": 3,
      "roaming": {
        "radius": 2.1,
        "idleMinSeconds": 1.1,
        "idleMaxSeconds": 2.7,
        "behaviorMultiplier": 0.24
      }
    },
    {
      "facing": "left",
      "x": 9,
      "animation": "Idle",
      "speciesId": "squirtle",
      "id": "squirtle-visitor",
      "y": 4,
      "roaming": {
        "radius": 1.5,
        "idleMinSeconds": 1.8,
        "idleMaxSeconds": 3.5,
        "behaviorMultiplier": 0.183
      }
    },
    {
      "facing": "down",
      "x": 5,
      "animation": "Idle",
      "speciesId": "pikachu",
      "id": "pikachu-visitor",
      "y": 4,
      "roaming": {
        "radius": 2.3,
        "idleMinSeconds": 0.7,
        "idleMaxSeconds": 1.9,
        "behaviorMultiplier": 0.317
      }
    },
    {
      "facing": "up-right",
      "x": 2,
      "animation": "Idle",
      "speciesId": "eevee",
      "id": "eevee-visitor",
      "y": 6,
      "roaming": {
        "radius": 2.6,
        "idleMinSeconds": 1.0,
        "idleMaxSeconds": 2.4,
        "behaviorMultiplier": 0.283
      }
    },
    {
      "facing": "up",
      "x": 8,
      "animation": "Idle",
      "speciesId": "clefairy",
      "id": "clefairy-visitor",
      "y": 6,
      "roaming": {
        "radius": 1.2,
        "idleMinSeconds": 2.2,
        "idleMaxSeconds": 4.4,
        "behaviorMultiplier": 0.147
      }
    },
    {
      "facing": "left",
      "x": 10,
      "animation": "Idle",
      "speciesId": "nidoran-m",
      "id": "nidoran-m-visitor",
      "y": 5,
      "roaming": {
        "radius": 1.7,
        "idleMinSeconds": 1.2,
        "idleMaxSeconds": 3.0,
        "behaviorMultiplier": 0.227
      }
    },
    {
      "facing": "up-right",
      "x": 6,
      "animation": "Idle",
      "speciesId": "nidoran-f",
      "id": "nidoran-f-visitor",
      "y": 7,
      "roaming": {
        "radius": 1.5,
        "idleMinSeconds": 1.6,
        "idleMaxSeconds": 3.4,
        "behaviorMultiplier": 0.203
      }
    },
    {
      "facing": "down-left",
      "x": 9,
      "animation": "Idle",
      "speciesId": "beedrill",
      "id": "beedrill-visitor",
      "y": 2,
      "roaming": {
        "radius": 2.8,
        "idleMinSeconds": 0.8,
        "idleMaxSeconds": 2.2,
        "behaviorMultiplier": 0.3
      }
    }
  ],
  "playerSpeciesId": "jigglypuff"
}
